{"absolute_change":{"denominator":null,"numerator":null,"reason":"NOT_COMPARABLE: COHORT_MISMATCH; OVERLAPPING_WINDOWS","status":"NOT_COMPARABLE","unit":"count","value":null},"caveats":["Descriptive comparison only; no causal lift or external equivalence claimed.","Descriptive observation only; no causal inference or lift claimed.","1 of 3 observation(s) NOT_AVAILABLE","Cohort mismatch: synthetic-cohort vs another-synthetic-cohort.","Measurement windows overlap; comparison periods are not disjoint."],"comparison_id":"a11-comparison-d9e5e472a81a3aa863913fb2867561c0a8fca3674ce8384b707e067beca7f7e6","comparison_policy":"NO_CROSS_PROVIDER_EQUIVALENCE","confounders":[{"code":"OVERLAPPING_WINDOWS","description":"Measurement windows overlap between baseline and comparison periods.","evidence_refs":[],"status":"OBSERVED"}],"inference":"DESCRIPTIVE_ONLY","left_report_ref":{"report_id":"a11-report-843b32f58b0f73f7dfc2a26bc9a9e5caee529d06c323e77034b2425a88ce965c"},"reason_codes":["COHORT_MISMATCH","OVERLAPPING_WINDOWS"],"relative_change":{"denominator":null,"numerator":null,"reason":"NOT_COMPARABLE: COHORT_MISMATCH; OVERLAPPING_WINDOWS","status":"NOT_COMPARABLE","unit":"ratio","value":null},"right_report_ref":{"report_id":"a11-report-fd4cf3c80a52bfa1bf27355ff64c0fadd21a14e6fe16f44de90fc6326edb0315"},"schema_version":"ComparisonResult.v1","source_status":"USER_SUPPLIED_NOT_LIVE_VERIFIED","status":"NOT_COMPARABLE"}