{"absolute_change":{"denominator":null,"numerator":12,"reason":null,"status":"AVAILABLE","unit":"count","value":12},"caveats":["Descriptive comparison only; no causal lift or external equivalence claimed.","Descriptive observation only; no causal inference or lift claimed.","1 of 3 observation(s) NOT_AVAILABLE","Relative change is INSUFFICIENT_DATA because baseline measurement is zero."],"comparison_id":"a11-comparison-20110dae369c3421ce2c0c41218030cedca6c8c6092f8ae297900f91239544db","comparison_policy":"NO_CROSS_PROVIDER_EQUIVALENCE","confounders":[],"inference":"DESCRIPTIVE_ONLY","left_report_ref":{"report_id":"a11-report-853268d2ebadc5ecadcc765beda2b55c319f6e788718499fbc6a43a64aab9893"},"reason_codes":["ZERO_DENOMINATOR"],"relative_change":{"denominator":0,"numerator":12,"reason":"Zero denominator","status":"INSUFFICIENT_DATA","unit":"ratio","value":null},"right_report_ref":{"report_id":"a11-report-843b32f58b0f73f7dfc2a26bc9a9e5caee529d06c323e77034b2425a88ce965c"},"schema_version":"ComparisonResult.v1","source_status":"USER_SUPPLIED_NOT_LIVE_VERIFIED","status":"AVAILABLE"}